
-------------------------------
: Pudin S.
: t.me/pudin_ira
: instagram.com/pudin.ira
: https://www.pdn.my.id
: youtube.com/c/pudintv
: youtube.com/c/pudintea

- Masuk ke CLI PosgtresSQL
Secara default postgres adalah user default pada postgreSQL, kalau di MySql kan biasanya root.
# sudo -u postgres psql postgres


- Mengganti Password pada PostgesSql
> \password postgres


- Membuat User Dan Database
Untuk membuat user baru kita dapat melakukannya dengan perintah berikut melalui terminal tanpa perlu login ke psql.

# createuser -h localhost -U postgres -D -A -P pudin

perintah diatas terdapat fungsi diantaranya adalah :
createuser : untuk membuat user baru
-h : artinya kita membuat user berdasarkan host di locahost
-U : kita ingin membuat user berdasarkan user default dari postgreSQL, secara default postgres adalah user default pada postgreSQL
-D : artinya user yang kita buat tidak dapat membuat database
-A : artinya user yang kita buat tidak dapat membuat user baru
-P : artinya user yang kita buat akan menggunakan password
pudin : na user baru yang akan kita buat


maka akan muncul perintah seperti berikut
# createuser -h localhost -U postgres -D -A -P pudin
Enter password for new role: 
Enter it again: 
Password:

berikut adalah penjelasan singkat dari masing - masing baris diatas :
Baris pertama dan kedua adalah password yang akan kita masukkan untuk user yang kita buat, misalnya disini penulis membuat user pudin
Baris ketiga adalah password dari default user atau super user yang kita gunakan, secara default kita masih menggunakan user postgres


Langkah selanjutnya adalah membuat database, untuk membuat database baru silahkan jalankan perintah berikut.

# createdb -h localhost -U postgres -E utf-8 -O pudin belajar-postgresql

codingan diatas berfungsi untuk membuat database baru, berikut adalah penjelasan dari sintak diatas.
createdb : untuk membuat database baru
-h : host yang kita gunakan
-U : user default untuk membuat database dan memiliki akses untuk membuat database baru
-E : artinya database yang akan kita buat memiliki format encoding utf-8
-O : artinya adalah database yang dibuat ini diberikan izin akses kepada user pudin
belajar-postgresql : adalah nama dari database yang kita buat.
kemudian masukkan password berdasarkan user postgres. Untuk login ke database melalui terminal, jalankan perintah berikut.

# psql -h localhost -U pudin belajar-postgresql
masukkan password berdasarkan user yang anda buat, maka akan muncul tampilan seperti berikut.

# psql -h localhost -U pudin belajar-postgresql 
Password for user pudin: 
psql (9.5.1)
SSL connection (protocol: TLSv1.2, cipher: ECDHE-RSA-AES256-GCM-SHA384, bits: 256, compression: off)
Type "help" for help.

belajar-postgresql=>


- Melakukan Instalasi PGAdmin
PGAdmin adalah salah satu editor atau GUI untuk melakukan akses terhadap database postgreSQL/ kalau di mysql biasanya phpmyadmin.

Sebenarnya masih banyak GUI yang lain untuk melakukan akses terhadap database postgreSQL, akan tetapi penulis hanya menggunakan pgAdmin, mengapa demikian ? dikarenakan kemudahan dalam konfigurasi database postgreSQL pada pgAdmin. Untuk melakukan instalasi pgAdmin silahkan jalankan perintah berikut.

# sudo apt-get install pgadmin3
# sudo apt-get install pgadmin4

kemudian silahkan buka pgadmin lewat browser.

------------------------------------------------------------------------
----- Latihan Query SQL Pada PostgreSQL -----
------------------------------------------------------------------------
Query yang akan kita pelajari disini hanya terdapat 4 yaitu dari select, insert, update dan delete. Untuk masalah query tidak memiliki perbedaan dengan dbms lain seperti mysql, mariadb, oracle dan lain sebagainya.

- Query Select
Query select berfungsi untuk mengambil data, sebelum menjalankan query select, kita akan membuat tabel terlebih dahulu, silahkan login terlebih dahulu melalui terminal anda ke psql. Setelah selesai kemudian jalankan perintah berikut.

CREATE TABLE mahasiswa(
    npm VARCHAR(8),
    nama VARCHAR(50) not null,
    kelas VARCHAR(5) not null,
    PRIMARY KEY(npm)
);

jalankan perintah diatas per baris, jika berhasil maka akan muncul seperti ini.

belajar-postgresql=> CREATE TABLE mahasiswa(
belajar-postgresql(> npm VARCHAR(8),
belajar-postgresql(> nama VARCHAR(50) not null,
belajar-postgresql(> kelas VARCHAR(5) not null,
belajar-postgresql(> PRIMARY KEY(npm)
belajar-postgresql(> );
CREATE TABLE

Untuk mengambil semua data, kita dapat melakukannya dengan perintah.

> SELECT * FROM mahasiswa;
maka akan muncul seperti ini.

belajar-postgresql=> SELECT * FROM mahasiswa;
 npm | nama | kelas 
-----+------+-------
(0 rows)

dapat dilihat bahwa data masih kosong dikarenakan kita belum melakukan inputan terhadap data mahasiswa.

- Query Insert
Query insert pada postgreSQL juga sama seperti pada dbms umunya, silahkan jalankan perintah berikut berikut untuk menyimpan sebuah data mahasiswa.

INSERT INTO mahasiswa (npm, nama, kelas) VALUES ('58412085', 'Muhammad Pudin', '4IA04');
jika berhasil maka akan muncul output seperti berikut.

belajar-postgresql=> INSERT INTO mahasiswa (npm, nama, kelas) VALUES ('58412085', 'Muhammad Pudin', '4IA04');
INSERT 0 1
kemudian lakukan pengecekan apakah data telah disimpan atau tidak dengan perintah select, jika data tersimpan maka akan muncul output seperti berikut.

belajar-postgresql=> SELECT * FROM mahasiswa;
   npm    |      nama      | kelas 
----------+----------------+-------
 58412085 | Muhammad Pudin | 4IA04
(1 row)

- Query Update
Query update biasanya digunakan untuk memperbarui sebuah data, untuk melakukan query update silahkan jalan perintah berikut.

UPDATE mahasiswa SET nama = 'M Pudin', kelas = '4IA04' WHERE npm = '58412085';
jika berhasil maka akan muncul output seperti berikut.

belajar-postgresql=> UPDATE mahasiswa SET nama = 'M Pudin', kelas = '4IA04' WHERE npm = '58412085';
UPDATE 1
kemudian lakukan pengecekan lagi dengan query select dan outputnya seperti berikut.

belajar-postgresql=> SELECT * FROM mahasiswa;
   npm    |  nama   | kelas 
----------+---------+-------
 58412085 | M Pudin | 4IA04
(1 row)

- Query Delete
Query yang terakhir adalah delete. Query ini berfungsi untuk menghapus data pada database. Jalankan perintah berikut untuk menghapus data.

DELETE FROM mahasiswa WHERE npm = '58412085';
jika berhasil maka akan muncul output seperti berikut.

belajar-postgresql=> DELETE FROM mahasiswa WHERE npm = '58412085';
DELETE 1
kemudian lakukan pengecekan kembali dengan perintah select dan berikut adalah hasilnya.

belajar-postgresql=> SELECT * FROM mahasiswa;
 npm | nama | kelas 
-----+------+-------
(0 rows)

Sekian artikel mengenai instalasi dan konfigurasi postgreSQL dan terima kasih :).



